{ "contract": "delivery-envelope", "contractVersion": "1.1.0", "envelopeId": "env.rule-4", "briefId": "brief.text-12", "briefRevision": 1, "contentRevision": 2, "policyRevision": 1, "ruleRevision": 4, "producer": { "engine": "postright", "engineVersion": "0.2.0" }, "platforms": ["x"], "payload": { "type": "text", "body": "Shipping the export preset flow today. Two clicks, no settings page.", "locale": "en-US" } }
